{
  "files": [
    {
      "generation": "core",
      "migration_history": [
        {
          "from_sha256": "4f6ccda5de094977a6f7d73d5e8f3fc01d7b7d5aa662b5f14a104bad58460dad",
          "receipt_path": "evals/test-migrations/v74-final-forward-confirmation-file.json",
          "receipt_sha256": "2313c5b6cad4d2f406a9360a7bb21cc5f08a8890da85632cf4726e670126ec0f",
          "to_sha256": "8e2d65038a22abe20e73d766aee25828a7c3f32cfa031bbb8191f1c53bf6b1f8"
        }
      ],
      "path": "tests/test_final_forward_regressions.py",
      "sha256": "8e2d65038a22abe20e73d766aee25828a7c3f32cfa031bbb8191f1c53bf6b1f8"
    },
    {
      "generation": "core",
      "migration_history": [
        {
          "from_sha256": "236e418d1a98b74b8ca1bbdde615475d4e49842a5ec2dc93435f0f8091d9ea36",
          "receipt_path": "evals/test-migrations/v74-identity-label-case-confirmation-file.json",
          "receipt_sha256": "27d7d81d5994030ad334bdaa2240bbfb7cccb905cea4209fe2a5cf4cb7af6423",
          "to_sha256": "2a89d2a30d21ef38375c59dbe53044a2f7bacd7a100f0214ae1122710debef95"
        }
      ],
      "path": "tests/test_identity_label_case.py",
      "sha256": "2a89d2a30d21ef38375c59dbe53044a2f7bacd7a100f0214ae1122710debef95"
    },
    {
      "generation": "core",
      "migration_history": [
        {
          "from_sha256": "22d12fce10212ccd655200a185fb32368af3bb9e14c897be3cdf7c280b77bad0",
          "receipt_path": "evals/test-migrations/v74-refinement-confirmation-file.json",
          "receipt_sha256": "a2bdbd520102fa5515cd79ffd4eba3c8fc1d408f987dadd2d8ff00df7fef41d4",
          "to_sha256": "7da244aea835aa7e48cec8e29ed79f6bf40da0709deaca1e943fd68c588bf0fd"
        }
      ],
      "path": "tests/test_refinement_regressions.py",
      "sha256": "7da244aea835aa7e48cec8e29ed79f6bf40da0709deaca1e943fd68c588bf0fd"
    },
    {
      "generation": "core",
      "migration_history": [
        {
          "from_sha256": "5f1cf5567bcc697be59c591cd921a29861f809cf5c86a4e965afa88eda5e8cfe",
          "receipt_path": "evals/test-migrations/v56-workflow-entrypoint.json",
          "receipt_sha256": "2b3c28ac8ab7258ffc6af9093cc2266a7b1515f90e921056a2b7ac63942b9424",
          "to_sha256": "1f679a835efd94f5610c2fb0ca60876491230c5b8a42e8dfe0efaae7487ed852"
        }
      ],
      "path": "tests/test_release_loop_contract.py",
      "sha256": "1f679a835efd94f5610c2fb0ca60876491230c5b8a42e8dfe0efaae7487ed852"
    },
    {
      "generation": "core",
      "path": "tests/test_release_package.py",
      "sha256": "b3fd945dd1dd606cded9d42bb5de2b8b39c71c4570f594dcdeadbcb4f92f9545"
    },
    {
      "generation": "v10",
      "migration_history": [
        {
          "from_sha256": "66a0605a35afc8d4169f0b103c6fd968bfe88755e4069723d57a8da88eedd566",
          "receipt_path": "evals/test-migrations/v53-v10-uncertain-label-context.json",
          "receipt_sha256": "19dad962fbe6f27f5d86c7e0144dcc1be91db9b918329ef321944a8a7d4329f8",
          "to_sha256": "bc16a41ef48db52226684b515ce5e0909c1f493405e880083b41aec9c153c1f2"
        }
      ],
      "path": "tests/test_v10_attribution_blind_regressions.py",
      "sha256": "bc16a41ef48db52226684b515ce5e0909c1f493405e880083b41aec9c153c1f2"
    },
    {
      "generation": "v10",
      "path": "tests/test_v10_attribution_event_integrity.py",
      "sha256": "da7a71c3d552c00fdb33ffb2ed742129f7d00b987be08ccda43188554cb0d988"
    },
    {
      "generation": "v10",
      "path": "tests/test_v10_clinical_audit_regressions.py",
      "sha256": "7770958f9e634d5a12916b30985299b5e3892fb3d498a2747edb19913bf7f836"
    },
    {
      "generation": "v10",
      "path": "tests/test_v10_clinical_p2_regressions.py",
      "sha256": "29e1bc84d91d42665f176c3dbe685f100e1510e7ebaa6c234bba420f02b46110"
    },
    {
      "generation": "v10",
      "migration_history": [
        {
          "from_sha256": "2ff9960dba02e89d141b3ee52ac603623de4e3343066187276366cae4da59f90",
          "receipt_path": "evals/test-migrations/v74-v10-state-confirmation-file.json",
          "receipt_sha256": "3cb8818802d39dcbb2b5eab9720168c38c69cca5306fdd190735400dd91a4dd6",
          "to_sha256": "6b83c8ee33f4c429848132738edc97057da237ad08b587c51612f27d7185fff1"
        }
      ],
      "path": "tests/test_v10_state_transaction_regressions.py",
      "sha256": "6b83c8ee33f4c429848132738edc97057da237ad08b587c51612f27d7185fff1"
    },
    {
      "generation": "v11",
      "path": "tests/test_v11_blind_semantic_regressions.py",
      "sha256": "0d8373101c860968f9bcb63d6b791852cb0b2ead8fe57d3c050e53dee8d288ca"
    },
    {
      "generation": "v11",
      "migration_history": [
        {
          "from_sha256": "b705a9dc22971fb5dbdd1c3618fbec4d0ffa8c353610c23928e70810f096494b",
          "receipt_path": "evals/test-migrations/v11-evolution-audit-receipts.json",
          "receipt_sha256": "4c7961b54384653a09bbb84b3fe104a769de4bbd24fd02799c1a284ab0d5d0a2",
          "to_sha256": "d8924197e45e2ffc43691bfd44b66aa1ab4c27dd6810d4967193e2843aebff8c"
        },
        {
          "from_sha256": "d8924197e45e2ffc43691bfd44b66aa1ab4c27dd6810d4967193e2843aebff8c",
          "receipt_path": "evals/test-migrations/v37-v11-release-run-binding.json",
          "receipt_sha256": "32fbab0d02ef440851febee12264b104699e39911f8e470826a3eb1aecb9f50e",
          "to_sha256": "56970c68bee3342904192548ba87403998988044e6071be5551424accbaed725"
        },
        {
          "from_sha256": "56970c68bee3342904192548ba87403998988044e6071be5551424accbaed725",
          "receipt_path": "evals/test-migrations/v37-v11-invalid-manifest-fixture-compatibility.json",
          "receipt_sha256": "d7d4cb5279298c3f0062b9bf5fe1d990e533538b9201236622a7f66d462bd59a",
          "to_sha256": "daecf2de7ba913ea9e2750ef49b139b5e8b514e65a34132aa38a7b6061d297c5"
        },
        {
          "from_sha256": "daecf2de7ba913ea9e2750ef49b139b5e8b514e65a34132aa38a7b6061d297c5",
          "receipt_path": "evals/test-migrations/v38-v11-file-backed-audit-fixtures.json",
          "receipt_sha256": "3c55c3b493e5f72bb440edf9d108ead7a60608f14f7094c66842e14c1fda7767",
          "to_sha256": "c74a1c1fc298a8e87e572f3d69cb4e4420b8526a4da0ca3a7ebdd6073b87339a"
        },
        {
          "from_sha256": "c74a1c1fc298a8e87e572f3d69cb4e4420b8526a4da0ca3a7ebdd6073b87339a",
          "receipt_path": "evals/test-migrations/v46-v11-audit-run-binding.json",
          "receipt_sha256": "398b7196d4629da9ed5a333832a806075a97159abbc2c99212c2876cde1b1233",
          "to_sha256": "e5c0689381a6c2e455d1a41be694f8e3bd4354ab1c861884845aa28172471eaa"
        },
        {
          "from_sha256": "e5c0689381a6c2e455d1a41be694f8e3bd4354ab1c861884845aa28172471eaa",
          "receipt_path": "evals/test-migrations/v57-v11-current-audit-receipt.json",
          "receipt_sha256": "73de3b645040d2e269bec9da8b87ea34a0e6e26b4bb784d9daf83ae213ca929a",
          "to_sha256": "0e3842bbb20796f2768096233a5aa35054c98c09e624cae389a2802f3a5c8679"
        },
        {
          "from_sha256": "0e3842bbb20796f2768096233a5aa35054c98c09e624cae389a2802f3a5c8679",
          "receipt_path": "evals/test-migrations/v71-v11-no-live-release-state-dependency.json",
          "receipt_sha256": "12bd85fb097a56ce29b571c48529566900dd48d56fe1935c09a2bdef220cb32a",
          "to_sha256": "02a68218131876777d22c86952af571e88958586d33d2a3f74d1e285d7fe9c75"
        },
        {
          "from_sha256": "02a68218131876777d22c86952af571e88958586d33d2a3f74d1e285d7fe9c75",
          "receipt_path": "evals/test-migrations/v73-v11-demo-lock-fixture.json",
          "receipt_sha256": "0111f1e68c317197324a04f4667dda2fc904b94a245dee1788ec046985aad65b",
          "to_sha256": "7cae032c36e31ea11d76bfe1788f7ffe7741932e5484ff4ad1761dffe4e74e85"
        }
      ],
      "path": "tests/test_v11_evolution_controller.py",
      "sha256": "7cae032c36e31ea11d76bfe1788f7ffe7741932e5484ff4ad1761dffe4e74e85"
    },
    {
      "generation": "v11",
      "migration_history": [
        {
          "from_sha256": "77f230a4b14d7c30a4c1bfa72fe7104a89affcb44a908f3fa3a5bfcae4f7ec14",
          "receipt_path": "evals/test-migrations/v74-v11-idempotency-confirmation-file.json",
          "receipt_sha256": "255e810f999f6356cc3cff0df2d9730fb560a270cdb286da4edcc65c677cc4a1",
          "to_sha256": "e2c15e4b85cc8fcf176cdeb7aea23a5d1ac63c5c47c6864b38ed7ec5856f6d34"
        }
      ],
      "path": "tests/test_v11_operation_idempotency.py",
      "sha256": "e2c15e4b85cc8fcf176cdeb7aea23a5d1ac63c5c47c6864b38ed7ec5856f6d34"
    },
    {
      "generation": "v11",
      "migration_history": [
        {
          "from_sha256": "63540e5b573c65f1f29daee8b24a2a67b98cbf5ed7c5a6d5af59e4fed32a5759",
          "receipt_path": "evals/test-migrations/v74-v11-integrity-confirmation-file.json",
          "receipt_sha256": "74a357565bb656ef96baabde03403d6bb119043fd5ba67da28885c7d3ce4d4c6",
          "to_sha256": "9bce3fd227139900c06b180f86282f050c1f149ce244fe9bbf26b4cd3718f52a"
        }
      ],
      "path": "tests/test_v11_operation_integrity.py",
      "sha256": "9bce3fd227139900c06b180f86282f050c1f149ce244fe9bbf26b4cd3718f52a"
    },
    {
      "generation": "v11",
      "path": "tests/test_v11_operational_cli.py",
      "sha256": "6485d1ad260e723a2afd93b3b0bad96204b4226f25dd40dd6ba59362dec734b9"
    },
    {
      "generation": "v11",
      "path": "tests/test_v11_semantic_validator_regressions.py",
      "sha256": "dc88c8f96b65e9697c8bdf938f19e4be0b67a6f2b4f21b5c10065c4381a97ac9"
    },
    {
      "generation": "v11",
      "path": "tests/test_v11_state_recovery_regressions.py",
      "sha256": "c1457daf5ada1c6e4a29837cb71a6c315ff73457578a180d9ce74ebda2e91d45"
    },
    {
      "generation": "v12",
      "migration_history": [
        {
          "from_sha256": "357985009f111819bb50519c2f5bf6f34521029174987b32de292d5e000c01d5",
          "receipt_path": "evals/test-migrations/v29-formal-scale-route-contract.json",